### ISSUE TITLE
oauth/login endpoint : "context deadline exceeded" error when invalid credentials are provided

### ISSUE THREAD

**Issue by omasseau** [gogatekeeper/gatekeeper#87]
# Title
oauth/login endpoint : "context deadline exceeded" error when invalid credentials are provided

## Summary
When using gatekeepers's oauth/login endpoint, if invalid credentials are provided then no response is returned to the client and I get a "context deadline exceeded" error in the Gatekeeper console

## Environment
- OS: Windows 10
- Keycloak 12.0.4
- Gatekeeper 1.3.1-3_windows_amd64

## Expected Results
I expect a response to my http request

## Actual Results
I get no response to my http request (timeout) and I get this error message after 30 secondes in the gatekeeper console:
`error   invalid user credentials provided       {"client_ip": "[::1]:58964", "error": "context deadline exceeded"}`

## Steps to reproduce
Start gatekeeper making sure these parameters are defined :
no-redirects: true
enable-login-handler: true

Use postman and call with POST method:
http://gatekeeper_host:gatekeeper_port/oauth/login

Provide wrong credentials (username/password) as entries of a x-www-form-urlencoded body.

## Additional Information
In postman I get this error after the timeout : 
Error: socket hang up

Note that when providing correct credentials everything workfs fine: 
I get the tokens immediately and correctly returned in the body of the http response.

**Comment by p53** [comment]
@omasseau hi could you provide all options you use with gatekeeper (assuming you don't use any custom federation on keycloak side?), i cannot reproduce it for me bad credentials return 401 (i tested locally) & tests are fine

```
curl -vvv -X POST --data-urlencode "username=mybadlogin" --data-urlencode "password=password123" http://localhost:6767/oauth/login
Note: Unnecessary use of -X or --request, POST is already inferred.
*   Trying 127.0.0.1:6767...
* TCP_NODELAY set
* Connected to localhost (127.0.0.1) port 6767 (#0)
> POST /oauth/login HTTP/1.1
> Host: localhost:6767
> User-Agent: curl/7.68.0
> Accept: */*
> Content-Length: 55
> Content-Type: application/x-www-form-urlencoded
> 
* upload completely sent off: 55 out of 55 bytes
* Mark bundle as not supporting multiuse
< HTTP/1.1 401 Unauthorized
< Date: Mon, 31 May 2021 11:20:42 GMT
< Content-Length: 0
< 
* Connection #0 to host localhost left intact
```

**Comment by omasseau** [comment]
@p53 Hi ;)

I don't use any custom federation on keycloak side.
Here is my yaml file: 
```

listen: :8280

client-id: service-jax-rs
client-secret: 6ecd0786-4407-4876-b092-9afbf88fbf7f

discovery-url: http://127.0.0.1:8180/auth/realms/demo

enable-login-handler: true

upstream-url: http://localhost:8080
```
And here is the curl result:
```

curl -vvv -X POST --data-urlencode "username=mybadlogin" --data-urlencode "password=password123" http://localhost:8280/oauth/login
Note: Unnecessary use of -X or --request, POST is already inferred.
*   Trying ::1...
* TCP_NODELAY set
* Connected to localhost (::1) port 8280 (#0)
> POST /oauth/login HTTP/1.1
> Host: localhost:8280
> User-Agent: curl/7.55.1
> Accept: */*
> Content-Length: 40
> Content-Type: application/x-www-form-urlencoded
>
* upload completely sent off: 40 out of 40 bytes
* Empty reply from server
* Connection #0 to host localhost left intact
curl: (52) Empty reply from server
```


It works perfectly when my credentials are valid : 

```
curl -vvv -X POST --data-urlencode "username=demo" --data-urlencode "password=demo" http://localhost:8280/oauth/login
Note: Unnecessary use of -X or --request, POST is already inferred.
*   Trying ::1...
* TCP_NODELAY set
* Connected to localhost (::1) port 8280 (#0)
> POST /oauth/login HTTP/1.1
> Host: localhost:8280
> User-Agent: curl/7.55.1
> Accept: */*
> Content-Length: 27
> Content-Type: application/x-www-form-urlencoded
>
* upload completely sent off: 27 out of 27 bytes
< HTTP/1.1 200 OK
< Content-Type: application/json
< Set-Cookie: kc-access=eyJhbGciOiJSUzI1NiIsInR5cCIgOiAiSldUIiwia2lkIiA6ICJ1N1MycFFaSHlRN1RHR3Z6RDY0b1B1b3BJQ2dVOVNWdG9iVHVhcWJvYXhFIn0.eyJleHAiOjE2MjI0NzM1OTEsImlhdCI6MTYyMjQ3MzI5MSwianRpIjoiZDUxYmVlZTMtZDI0ZS00ZjY3LWI0ZWEtZDkwNzNmMWM3NGRiIiwiaXNzIjoiaHR0cDovLzEyNy4wLjAuMTo4MTgwL2F1dGgvcmVhbG1zL2RlbW8iLCJhdWQiOlsic2VydmljZS1qYXgtcnMiLCJhY2NvdW50Il0sInN1YiI6ImM3MzBlMmQ4LTFiOGEtNDMzZi1hMWVlLWYwNGI2YjdhNTI3YSIsInR5cCI6IkJlYXJlciIsImF6cCI6InNlcnZpY2UtamF4LXJzIiwic2Vzc2lvbl9zdGF0ZSI6IjJjOTQzODc5LWIwOTUtNGQwNS05ODRiLTc0MDYwZjJiYjYyMyIsImFjciI6IjEiLCJyZWFsbV9hY2Nlc3MiOnsicm9sZXMiOlsib2ZmbGluZV9hY2Nlc3MiLCJ1bWFfYXV0aG9yaXphdGlvbiIsInVzZXIiXX0sInJlc291cmNlX2FjY2VzcyI6eyJhY2NvdW50Ijp7InJvbGVzIjpbIm1hbmFnZS1hY2NvdW50IiwibWFuYWdlLWFjY291bnQtbGlua3MiLCJ2aWV3LXByb2ZpbGUiXX19LCJzY29wZSI6Im9wZW5pZCBwcm9maWxlIGVtYWlsIiwiZW1haWxfdmVyaWZpZWQiOmZhbHNlLCJwcmVmZXJyZWRfdXNlcm5hbWUiOiJkZW1vIn0.PUTdzPElyVMZ7G6ak_f3racqSaX457F6FsrKv7dOTe9WKtrlD20y3vx8V68xKMsUOCVHRynLoNGr5yAXXDwKriMAOsJt4zkp6VbogQdSvWqXFm3XONlROA1r9OM4rv3lt4C3Bho52Vh4HEw9CKl_02UJx_00_759__9_VfIHfH6DV5WOH4viPhM2vFkZG3TSE306wH0ygH9AZ8fitvF2Ve7l7hk3LKBcIP7g8igpOeS_AeqodJjecvMQXBVesne45CP_I0DWHYz0604zHaDZJ1M-SfuFFvZobUIgU9siEeLWAChGtEKY7L0kFY6q5ga3Sks4KeapmQa-bWTxGUaUvg; Path=/; HttpOnly; Secure; SameSite=Lax
< Date: Mon, 31 May 2021 15:01:31 GMT
< Transfer-Encoding: chunked
<
{"token_type":"","access_token":"eyJhbGciOiJSUzI1NiIsInR5cCIgOiAiSldUIiwia2lkIiA6ICJ1N1MycFFaSHlRN1RHR3Z6RDY0b1B1b3BJQ2dVOVNWdG9iVHVhcWJvYXhFIn0.eyJleHAiOjE2MjI0NzM1OTEsImlhdCI6MTYyMjQ3MzI5MSwianRpIjoiZDUxYmVlZTMtZDI0ZS00ZjY3LWI0ZWEtZDkwNzNmMWM3NGRiIiwiaXNzIjoiaHR0cDovLzEyNy4wLjAuMTo4MTgwL2F1dGgvcmVhbG1zL2RlbW8iLCJhdWQiOlsic2VydmljZS1qYXgtcnMiLCJhY2NvdW50Il0sInN1YiI6ImM3MzBlMmQ4LTFiOGEtNDMzZi1hMWVlLWYwNGI2YjdhNTI3YSIsInR5cCI6IkJlYXJlciIsImF6cCI6InNlcnZpY2UtamF4LXJzIiwic2Vzc2lvbl9zdGF0ZSI6IjJjOTQzODc5LWIwOTUtNGQwNS05ODRiLTc0MDYwZjJiYjYyMyIsImFjciI6IjEiLCJyZWFsbV9hY2Nlc3MiOnsicm9sZXMiOlsib2ZmbGluZV9hY2Nlc3MiLCJ1bWFfYXV0aG9yaXphdGlvbiIsInVzZXIiXX0sInJlc291cmNlX2FjY2VzcyI6eyJhY2NvdW50Ijp7InJvbGVzIjpbIm1hbmFnZS1hY2NvdW50IiwibWFuYWdlLWFjY291bnQtbGlua3MiLCJ2aWV3LXByb2ZpbGUiXX19LCJzY29wZSI6Im9wZW5pZCBwcm9maWxlIGVtYWlsIiwiZW1haWxfdmVyaWZpZWQiOmZhbHNlLCJwcmVmZXJyZWRfdXNlcm5hbWUiOiJkZW1vIn0.PUTdzPElyVMZ7G6ak_f3racqSaX457F6FsrKv7dOTe9WKtrlD20y3vx8V68xKMsUOCVHRynLoNGr5yAXXDwKriMAOsJt4zkp6VbogQdSvWqXFm3XONlROA1r9OM4rv3lt4C3Bho52Vh4HEw9CKl_02UJx_00_759__9_VfIHfH6DV5WOH4viPhM2vFkZG3TSE306wH0ygH9AZ8fitvF2Ve7l7hk3LKBcIP7g8igpOeS_AeqodJjecvMQXBVesne45CP_I0DWHYz0604zHaDZJ1M-SfuFFvZobUIgU9siEeLWAChGtEKY7L0kFY6q5ga3Sks4KeapmQa-bWTxGUaUvg","id_token":"eyJhbGciOiJSUzI1NiIsInR5cCIgOiAiSldUIiwia2lkIiA6ICJ1N1MycFFaSHlRN1RHR3Z6RDY0b1B1b3BJQ2dVOVNWdG9iVHVhcWJvYXhFIn0.eyJleHAiOjE2MjI0NzM1OTEsImlhdCI6MTYyMjQ3MzI5MSwiYXV0aF90aW1lIjowLCJqdGkiOiI1ZDhhMzc5Ny1hNTcxLTQ1NmItYWRjMC1hNjI1OTkyZGJhNmQiLCJpc3MiOiJodHRwOi8vMTI3LjAuMC4xOjgxODAvYXV0aC9yZWFsbXMvZGVtbyIsImF1ZCI6InNlcnZpY2UtamF4LXJzIiwic3ViIjoiYzczMGUyZDgtMWI4YS00MzNmLWExZWUtZjA0YjZiN2E1MjdhIiwidHlwIjoiSUQiLCJhenAiOiJzZXJ2aWNlLWpheC1ycyIsInNlc3Npb25fc3RhdGUiOiIyYzk0Mzg3OS1iMDk1LTRkMDUtOTg0Yi03NDA2MGYyYmI2MjMiLCJhdF9oYXNoIjoiUloxWExlcktOMnM4STFPSmM3RWowZyIsImFjciI6IjEiLCJlbWFpbF92ZXJpZmllZCI6ZmFsc2UsInByZWZlcnJlZF91c2VybmFtZSI6ImRlbW8ifQ.HbLyGy3zX7za8zUhY9KCVptvKN_-d83fYHoV0irYYBnsZBIUoQf1SW0Lnp5jeZEZrUw0L8Q4dKcqQMk2NkHj1epSwUuVl0U8j4JhqPQWFxUY_1g3ixDZP_PlQQ_MfuM2G6makZZRnXhk5qYCuXHao-FTAdI6vgLhY_YllONhPppgUNSlR7Y-pckwJ61-di9VS51_D7vM3aoCgRsRxojTLPP1pGFRTmLImaGEanjS-forvoFUWTTVmS8QbffdHNzmndaoXpKhACEs1e_XQAZ76YZtIdAtum411heJah5JWdrffsepGhbtuYpsgXn80Mu5VY01--srCx3PxGPpy6hwEg","refresh_token":"eyJhbGciOiJIUzI1NiIsInR5cCIgOiAiSldUIiwia2lkIiA6ICJmNDU1NjgzNy0yNjY1LTRiMjMtOGY0ZS0wZjQ3YmE1MWFhNmEifQ.eyJleHAiOjE2MjI0NzUwOTEsImlhdCI6MTYyMjQ3MzI5MSwianRpIjoiYzFkNjU1MDMtMWI4NS00MTkxLTk3MjMtNDY4NjNjZjkzZDNkIiwiaXNzIjoiaHR0cDovLzEyNy4wLjAuMTo4MTgwL2F1dGgvcmVhbG1zL2RlbW8iLCJhdWQiOiJodHRwOi8vMTI3LjAuMC4xOjgxODAvYXV0aC9yZWFsbXMvZGVtbyIsInN1YiI6ImM3MzBlMmQ4LTFiOGEtNDMzZi1hMWVlLWYwNGI2YjdhNTI3YSIsInR5cCI6IlJlZnJlc2giLCJhenAiOiJzZXJ2aWNlLWpheC1ycyIsInNlc3Npb25fc3RhdGUiOiIyYzk0Mzg3OS1iMDk1LTRkMDUtOTg0Yi03NDA2MGYyYmI2MjMiLCJzY29wZSI6Im9wZW5pZCBwcm9maWxlIGVtYWlsIn0.1RnvSFEa4OPzzvJCfPJS-TVnHicJuxh6aclNEkmf9P0","expires_in":300,"scope":"openid profile email"}
* Connection #0 to host localhost left intact

```

**Comment by p53** [comment]
@omasseau i used exact same options and i am getting 401 (using docker image 1.3.1):

```
      - --listen=0.0.0.0:8080
      - --no-redirects=true
      - --client-id=someclient
      - --client-secret=3ed534a6-146d-4c66-bdb7-48af4b8fd8d4
      - --discovery-url=http://keycloak:8080/auth/realms/master
      - --upstream-url=http://somehost.com:9090
      - --enable-login-handler=true
```

and as i checked you are getting empty reply from server message which is quite weird

**Comment by omasseau** [comment]
@p53 Hum weird indeed. OK I will try with the docker image ;)
Juste to be sure, you did your tests with Keycloak 12.0.4 ?

**Comment by p53** [comment]
@omasseau yes i tried with 12.0.4 image, could be also issue with windows binary -> if docker image will work

**Comment by omasseau** [comment]
I've not tried with the image yet, but it seems it is Keycloak that is not responding if I check with Wireshark.
The call to Keycloak endpoint  /auth/realms/demo/protocol/openid-connect/token running on port 8180 is correctly done (ACK on the second line)

After the timeout of 30s, Gatekeeper decides to naturally close the connection (FIN on the 5th line).

```
No.     Time        Source      Destination Protocol    Length  Info
681     0.792347    127.0.0.1   127.0.0.1   HTTP        433     POST /auth/realms/demo/protocol/openid-connect/token HTTP/1.1  (application/x-www-form-urlencoded)
682     0.792365    127.0.0.1   127.0.0.1   TCP         44      8180 → 60371 [ACK] Seq=1 Ack=390 Win=2619648 Len=0

2720    30.791932   127.0.0.1   127.0.0.1   TCP         45      [TCP Keep-Alive] 60371 → 8180 [ACK] Seq=389 Ack=1 Win=2619648 Len=1
2721    30.791958   127.0.0.1   127.0.0.1   TCP         56      [TCP Keep-Alive ACK] 8180 → 60371 [ACK] Seq=1 Ack=390 Win=2619648 Len=0 SLE=389 SRE=390

2722    30.791976   127.0.0.1   127.0.0.1   TCP         44      60371 → 8180 [FIN, ACK] Seq=390 Ack=1 Win=2619648 Len=0
2723    30.791992   127.0.0.1   127.0.0.1   TCP         44      8180 → 60371 [ACK] Seq=1 Ack=391 Win=2619648 Len=0
```

So the problem seems to be on the Keycloak side.

**Comment by omasseau** [comment]
Well after determining that the problem was on the Keycloak side, restarting the Keycloak server fixed the problem.
I hope it wil not happen again. Else I will create a Keycloak issue.
Thanks for looking :)
